Company,Crunchbase,Industries,Location,Employee Count,Founded Date,Investor Count,Lead Investor Count,Select Investors,Funding,Round
Tractable,https://www.crunchbase.com/organization/tractable,"Artificial Intelligence, Insurance, Machine Learning, Software","London, England, United Kingdom",101-250,2014,16.0,5.0,"Insight Partners, Ignition Partners, Zetta Venture Partners, Entrepreneur First",$35 ,5.0
TuSimple,https://www.crunchbase.com/organization/tusimple-llc,"Artificial Intelligence, Autonomous Vehicles, Transportation","San Diego, California, United States",251-500,2015,14.0,3.0,"CDH Investments, Sina Weibo Fund, Composite Capital Partners, NVIDIA GPU Ventures, UPS Strategic Enterprise Fund",$297 ,6.0
Viz.ai,https://www.crunchbase.com/organization/viz,"Artificial Intelligence, Health Care, Health Diagnostics, Machine Learning, Medical","San Francisco, California, United States",51-100,2016,10.0,4.0,"Google Ventures, Kleiner Perkins Caufield & Byers, Greenoaks Capital Management, Threshold Ventures, CRV",$79 ,5.0
Voyage,https://www.crunchbase.com/organization/voyage,"Automotive, Autonomous Vehicles, Leisure, Public Transportation, Robotics","Palo Alto, California, United States",51-100,17-Feb,8.0,1.0,"Khosla Ventures, CRV, Franklin Templeton, Initialized Capital, SV Angel",$54 ,2.0
WellSaid Labs,,Synthetic voice,"Seattle, Washington, United States",,,,,Allen Institute for Artificial Intelligence,,
Xanadu,https://www.crunchbase.com/organization/xanadu-2,"Artificial Intelligence, Big Data, Hardware, Quantum Computing, Software","Toronto, Ontario, Canada",51-100,19-Sep-16,10.0,3.0,"Silicon Valley Bank, OMERS Ventures, Real Ventures, Georgian Partners, Sustainable Development Technology Canada",$34 ,5.0
Zebra Medical Vision,https://www.crunchbase.com/organization/zebra-medical-vision,"Artificial Intelligence, Health Care, Health Diagnostics, Machine Learning, Medical","Shefayim, HaMerkaz, Israel",Nov-50,2014,13.0,3.0,"Khosla Ventures, OurCrowd, Johnson & Johnson Innovation, Marc Benioff, Dolby Family Ventures",$50 ,3.0
Zesty.ai,https://www.crunchbase.com/organization/zesty-ai,"Analytics, Artificial Intelligence, InsurTech, Real Estate, Software","Oakland, California, United States",Nov-50,2015,2.0,1.0,"Plug and Play Ventures, Zurich Insurance Group, Plug and Play Accelerator, Blamar",$13 ,1.0
Zhuiyi Technology,https://www.crunchbase.com/organization/zhuiyi-technology,"Artificial Intelligence, Machine Learning, Software","Shenzhen, Guangdong, China",251-500,2016,5.0,4.0,"Morningside Venture Capital, GGV Capital, Gaorong Capital, China Merchants Capital, Sinovation Ventures",$62 ,3.0
