Company,Crunchbase,Industries,Location,Select Investors,FundingCount4Paradigm,https://www.crunchbase.com/organization/4paradigm,"Artificial Intelligence, Information Services, Software","Beijing, Beijing, China","Sequoia Capital China, Industrial and Commercial Bank of China, China Construction Bank, Bank of China, Genesis Capital",$145 Abnormal Security,https://www.crunchbase.com/organization/abnormal-security,"Cyber Security, Information Technology, Network Security, Security","San Francisco, California, United States",Greylock Partners,$24 Affectiva,https://www.crunchbase.com/organization/affectiva,"Artificial Intelligence, Automotive, Digital Marketing, Health Care, Human Resources","Boston, Massachusetts, United States","Kleiner Perkins Caufield & Byers, Horizons Ventures, Pegasus Tech Ventures, Trend Forward Capital, National Science Foundation",$60 AiFi,https://www.crunchbase.com/organization/aifi-c8f8,"Artificial Intelligence, Computer Vision, Retail Technology, Software","Santa Clara, California, United States","Greylock Partners, Plug and Play Ventures, TransLink Capital, Cervin Ventures, Plug and Play Accelerator",$15 AInnovation,https://www.crunchbase.com/organization/ainnovation,"Artificial Intelligence, B2B, Information Technology, Machine Learning, Software","Haidian, Beijing, China","China Renaissance, CreditEase Fintech Investment Fund, CICC ALPHA, Sinovation Ventures, Chengwei Capital",$116 Algorithmia,https://www.crunchbase.com/organization/algorithmia,"Artificial Intelligence, Cloud Computing, Developer Tools, Software","Seattle, Washington, United States","Madrona Venture Group, Norwest Venture Partners, Osage University Partners, Rakuten Ventures, Gradient Ventures",$39 ALICE Technologies,https://www.crunchbase.com/organization/alice-technologies,"Construction, Innovation Management, Real Estate, Software","Menlo Park, California, United States","Lightspeed Venture Partners, Blackhorn Ventures, Merus Capital, Foundamental",$10 AMP Robotics,https://www.crunchbase.com/organization/amp-robotics,"Artificial Intelligence, Environmental Engineering, Information Technology, Intelligent Systems, Machine Learning, Recycling, Robotics","Louisville, Colorado, United States","Sequoia Capital, Congruent Ventures, BV Investment Partners, Closed Loop Partners, Sidewalk Infrastructure Partners",$23 ArthurAI,https://www.crunchbase.com/organization/arthur-ai,Software,"New York, New York, United States","Index Ventures, Work-Bench, Homebrew, Jerry Yang, Hunter Walk",$3 Atomwise,https://www.crunchbase.com/organization/atomwise,"Artificial Intelligence, Health Care, Machine Learning, Medical, Pharmaceutical","San Francisco, California, United States","Tencent Holdings, Y Combinator, Khosla Ventures, Threshold Ventures, Data Collective",$51 Aurora,https://www.crunchbase.com/organization/aurora-6292,"Automotive, Autonomous Vehicles, Transportation","Palo Alto, California, United States","T. Rowe Price, Baillie Gifford & Co., CPP Investment Board, Sequoia Capital, Index Ventures",$693 Benson Hill,https://www.crunchbase.com/organization/benson-hill-biosystems,"Agriculture, AgTech, Biotechnology, Cloud Computing, Product Research","St Louis, Missouri, United States","Google Ventures, Alexandria Venture Investments, S2G Ventures, Prelude Ventures, Mercury Fund",$127 Beyond Limits,https://www.crunchbase.com/organization/beyond-limits,"Artificial Intelligence, Internet of Things, Machine Learning, Software","Glendale, California, United States","BP Ventures, Xcell Group",$20 Blue Hexagon,https://www.crunchbase.com/organization/blue-hexagon,"Artificial Intelligence, Cyber Security, Machine Learning","San Francisco, California, United States","Benchmark, Altimeter Capital",$37 Bowery Farming,https://www.crunchbase.com/organization/bowery-farming-inc,"Agriculture, Farming, Food and Beverage, Organic Food, Robotics","New York, New York, United States","Temasek, GGV Capital, Google Ventures, General Catalyst, First Round Capital",$168 BUILT Robotics,https://www.crunchbase.com/organization/built-robotics,"Artificial Intelligence, Autonomous Vehicles, Construction, Industrial Automation, Machine Learning, Robotics","San Francisco, California, United States","New Enterprise Associates, Founders Fund, Fifth Wall Ventures, next47, Presidio Ventures",$48 Butterfly Network,https://www.crunchbase.com/organization/butterfly-network,"Electronics, Health Care, Medical Device, Personal Health, Software","Guilford, Connecticut, United States","Fidelity Investments, Bill & Melinda Gates Foundation, Fosun Pharmaceutical, Stanford University, Jamie Dinan",$350 C3.ai,https://www.crunchbase.com/organization/c3,"Artificial Intelligence, Big Data, Cloud Computing, Enterprise Applications, Enterprise Software, Machine Learning, PaaS, Predictive Analytics, Software","Redwood City, California, United States","TPG Growth, Sutter Hill Ventures, Breyer Capital, The Rise Fund, InterWest Partners",$243 Caspar.AI,https://www.crunchbase.com/organization/brain-of-things,"Construction, Intelligent Systems, Operating Systems, Predictive Analytics, Privacy, Property Management, Real Estate, Sustainability","Redwood City, California, United States",,Citrine Informatics,https://www.crunchbase.com/organization/citrine-informatics,"Advanced Materials, Analytics, Artificial Intelligence, Big Data, Machine Learning","Redwood City, California, United States","Tencent Holdings, Data Collective, Innovation Endeavors, next47, AME Cloud Ventures",$36 ClimaCell,https://www.crunchbase.com/organization/climacell,"Big Data, Environmental Consulting, Software","Boston, Massachusetts, United States","SoftBank Group, Canaan Partners, Square Peg Capital, JetBlue Technology Ventures, Fontinalis Partners",$71 ComplyAdvantage,https://www.crunchbase.com/organization/comply-advantage,"Artificial Intelligence, Information Services, Information Technology","London, England, United Kingdom","Index Ventures, Balderton Capital",$38 Concerto HealthAI,https://www.crunchbase.com/organization/concerto-healthai,Artificial Intelligence,"Boston, Massachusetts, United States","Declaration Partners, Maverick Ventures, AllianceBernstein, SymphonyAI Group, Symphony Technology Group",$170 Covariant AI,https://www.crunchbase.com/organization/embodied-intelligence,"Artificial Intelligence, Robotics, Software","Emeryville, California, United States","Lux Capital, SV Angel, FreesFund, Samsung NEXT, 11.2 Capital",$7 Cresta,https://www.crunchbase.com/organization/cresta,"Artificial Intelligence, Machine Learning, Software","Palo Alto, California, United States",Andreessen Horowitz,Cyclica,https://www.crunchbase.com/organization/cyclica,"Artificial Intelligence, Biotechnology, Pharmaceutical","Toronto, Ontario, Canada","GreenSky Capital, Epic Capital Management, Grants4Apps, JLabs",$4 DarwinAI,https://www.crunchbase.com/organization/darwinai,"Artificial Intelligence, Education, Software","Waterloo, Ontario, Canada","Obvious Ventures, Inovia Capital, Lazaridis Scale-Up Program",$3 DataProphet,https://www.crunchbase.com/organization/data-prophet-pty-ltd-,"Artificial Intelligence, Automotive, Foundries, Information Technology, Internet of Things, Manufacturing, Mineral, Predictive Analytics, SaaS, Software","Cape Town, NA - South Africa, South Africa","Yellowwoods, Knife Capital, Webber Wentzel Ignite Incubator",$0 DataRobot,https://www.crunchbase.com/organization/datarobot,"Artificial Intelligence, Enterprise Software, Information Technology, Machine Learning, Predictive Analytics, Robotics, SaaS","Boston, Massachusetts, United States","New Enterprise Associates, Tiger Global Management, Intel Capital, Sapphire Ventures, Meritech Capital Partners",$431 Deeplite,https://www.crunchbase.com/organization/deeplite,"Artificial Intelligence, Computer Vision, Embedded Systems, Information Technology, Machine Learning, Software","Montrթal, Quebec, Canada","TandemLaunch, The Blackberry/L-Spark Accelerator",$1 DeepSig,https://www.crunchbase.com/organization/deepsig-inc,"Artificial Intelligence, Machine Learning, Wireless","Arlington, Virginia, United States",Scout Ventures,$2 Dorabot,https://www.crunchbase.com/organization/dorabot,"Artificial Intelligence, Logistics, Machine Learning, Robotics, Service Industry, Warehousing","Shenzhen, Guangdong, China","Yunfeng Capital, GP Capital, Sinovation Ventures, Hongtai Capital Holdings, Plug and Play Accelerator",$2 dotData,https://www.crunchbase.com/organization/dotdata,"Artificial Intelligence, Big Data, Data Center Automation, Industrial Automation, Information Technology","Cupertino, California, United States","Goldman Sachs, JAFCO Co., NEC, Microsoft ScaleUp",$23 Eko,https://www.crunchbase.com/organization/eko-health,"Artificial Intelligence, Electronic Health Record (EHR), Health Care, Health Diagnostics, Machine Learning, Medical Device, mHealth, Mobile, Software","Berkeley, California, United States","Artis Ventures, StartX, Mayo Clinic, 3M Ventures, DreamIt Ventures",$27 Faire,https://www.crunchbase.com/organization/indigo-fair,"E-Commerce, Marketplace, Retail, Retail Technology, Wholesale","San Francisco, California, United States","Sequoia Capital, Lightspeed Venture Partners, Khosla Ventures, Y Combinator, DST Global",$266 Falkonry,https://www.crunchbase.com/organization/falkonry,"Artificial Intelligence, Industrial, Internet of Things, Machine Learning, National Security, Predictive Analytics, SaaS, Software","Sunnyvale, California, United States","Polaris Partners, Zetta Venture Partners, Presidio Ventures, Basis Set Ventures, Start Smart Labs",$10 FanAI,https://www.crunchbase.com/organization/fanai-inc,"Artificial Intelligence, eSports, Fantasy Sports, Internet, Location Based Services, Social Media","Santa Monica, California, United States","Greycroft, Rosecliff Ventures, Courtside Ventures, Marubeni, M Ventures",$12 Featurespace,https://www.crunchbase.com/organization/featurespace,"Banking, FinTech, Fraud Detection, Risk Management","Cambridge, England, United Kingdom","Insight Partners, Highland Europe, TTV Capital, IP Group, MissionOG",$73 Ghost Locomotion,https://www.crunchbase.com/organization/ghost-locomotion,"Automotive, Autonomous Vehicles, Electric Vehicle, Product Design, Transportation","Mountain View, California, United States","Founders Fund, Khosla Ventures, Sutter Hill Ventures",$64 Grabango,https://www.crunchbase.com/organization/grabango,"Computer Vision, Machine Learning, Retail Technology","Berkeley, California, United States","Founders Fund, Propel Venture Partners, Commerce Ventures, Ridge Ventures, Abstract Ventures",$12 Graphcore,https://www.crunchbase.com/organization/graphcore,"Artificial Intelligence, Hardware, Machine Learning, Semiconductor","Bristol, England, United Kingdom","Sequoia Capital China, Baillie Gifford & Co., Sequoia Capital, Dell Technologies Capital, Atomico",$536 H2O.ai,https://www.crunchbase.com/organization/h2o-2,"Analytics, Artificial Intelligence, Big Data, Cloud Computing, Machine Learning, Software","Mountain View, California, United States","Nexus Venture Partners, Wells Fargo & Company, GS Growth, CreditEase Fintech Investment Fund, Ping An Ventures",$146 HACARUS,https://www.crunchbase.com/organization/hacarus,"Artificial Intelligence, Life Science, Machine Learning, Manufacturing, Medical","Kyoto, Kyoto, Japan","Plug and Play Accelerator, Kaga Electronics, Innovation Engine, Miyako Capital, Ohara Pharmaceutical",$2 Healthy.io,https://www.crunchbase.com/organization/healthy-io,"Health Care, Health Diagnostics, Medical, Mobile Apps, Software","Tel Aviv-yafo, Tel Aviv, Israel","JOY Capital, Samsung NEXT, Aleph, Corner Ventures, Ansonia Holdings Singapore",$78 Heuritech,https://www.crunchbase.com/organization/heuritech,"Artificial Intelligence, Fashion, Machine Learning","Paris, Ile-de-France, France","Serena Capital, Hewlett Packard Enterprise, Elaia Partners, SAP.iO Foundry, Renaud Visage",$6 HoloMatic,https://www.crunchbase.com/organization/holomatic,"Artificial Intelligence, Automotive, Autonomous Vehicles, Information Technology, Sensor, Software, Transportation","Beijing, Beijing, China","Sequoia Capital China, IDG Capital, Bertelsmann Asia Investments, NavInfo, Fanhai Investment",Hugging Face,https://www.crunchbase.com/organization/hugging-face,"Artificial Intelligence, Computer, Machine Learning, Software","New York, New York, United States","Lux Capital, SV Angel, The Chernin Group, Thirty Five Ventures, A.Capital",$24 HyperScience,https://www.crunchbase.com/organization/hyperscience,"Artificial Intelligence, Big Data, Cloud Data Services, Data Center Automation, Enterprise Applications, Enterprise Software, Machine Learning, Predictive Analytics, SaaS","New York, New York, United States","FirstMark Capital, Battery Ventures, Felicis Ventures, Global Founders Capital, SV Angel",$49 InstaDeep,https://www.crunchbase.com/organization/instadeep,Artificial Intelligence,"London, England, United Kingdom","Endeavor, Plug and Play Accelerator, AfricInvest",$7 Integrate.ai,https://www.crunchbase.com/organization/integrate-ai,"Artificial Intelligence, Data Integration, Enterprise, Enterprise Software, Machine Learning, Natural Language Processing, SaaS, Software","Toronto, Ontario, Canada","Georgian Partners, Real Ventures, Portag3 Ventures, TELUS Ventures, Jordan Banks",$38 Invenia,https://www.crunchbase.com/organization/invenia,"Analytics, Computer, Software","Winnipeg, Manitoba, Canada","Social Capital, Zetta Venture Partners",$5 iSee,https://www.crunchbase.com/organization/isee-c0f5,"Artificial Intelligence, Automotive, Autonomous Vehicles, Machine Learning","Cambridge, Massachusetts, United States","Founders Fund, The Engine",$18 Kneron,https://www.crunchbase.com/organization/kneron,"Artificial Intelligence, Information Technology, Internet of Things, Robotics, Software","San Diego, California, United States","Sequoia Capital China, Horizons Ventures, Qualcomm Ventures, Alibaba Entrepreneurs Fund, CDIB Venture Capital Corp.",$73 KONUX,https://www.crunchbase.com/organization/konux,"Artificial Intelligence, Industrial Automation, Information Technology, Internet of Things, Machine Learning, Predictive Analytics, Railroad","Munich, Bayern, Germany","New Enterprise Associates, Alibaba Group, Unternehmertum Venture Capital, MIG Verwaltungs, Andy Bechtolsheim",$50 Korbit,https://www.crunchbase.com/organization/korbit-ai,"Artificial Intelligence, Education, Information Technology, Machine Learning, MOOC, Natural Language Processing, Tutoring","Montr_al, Quebec, Canada","Softbank Ventures Asia, Digital Currency Group, NEXON, Pantera Capital, Tim Draper",$2 Kyndi,https://www.crunchbase.com/organization/kyndi,"Artificial Intelligence, Life Science, Machine Learning, Natural Language Processing, Software","San Mateo, California, United States","Intel Capital, PivotNorth Capital, Cendana Capital, UL Ventures, Plug and Play Accelerator",$32 Lemonade,https://www.crunchbase.com/organization/lemonade,"Artificial Intelligence, Financial Services, Insurance, InsurTech","New York, New York, United States","SoftBank Group, Google Ventures, Sequoia Capital, General Catalyst, Thrive Capital",$480 Lexion,https://www.crunchbase.com/organization/lexion,Information Technology,"Seattle, Washington, United States","Madrona Venture Group, Wilson Sonsini Goodrich & Rosati",$4 Lightmatter,https://www.crunchbase.com/organization/lightmatter-inc,"Artificial Intelligence, Hardware, Software","Boston, Massachusetts, United States","Google Ventures, Spark Capital, Matrix Partners, MIT $100K Entrepreneurship Competition",$33 Loadsmart,https://www.crunchbase.com/organization/loadsmart,"Logistics, Supply Chain Management, Transportation","New York, New York, United States","Maersk Growth, Chromo Invest, Connor Capital SB, Ports America",$54 Mapillary,https://www.crunchbase.com/organization/mapillary,"Artificial Intelligence, Automotive, Crowdsourcing, Mapping Services, Mobile, Photography","Malmo, Skane Lan, Sweden","Sequoia Capital, Atomico, BMW i Ventures, Wellington Partners, Samsung Catalyst Fund",$25 Metawave,https://www.crunchbase.com/organization/metawave-corporation,"Artificial Intelligence, Automotive, Communications Infrastructure, Telecommunications, Wireless","Palo Alto, California, United States","Khosla Ventures, Mirae Asset Capital, DENSO, BOLD Capital Partners, Autotech Ventures",$17 NavVis,https://www.crunchbase.com/organization/navvis,"Indoor Positioning, Information Technology, Location Based Services, Navigation, Software","Munich, Bayern, Germany","DIGITAL+ PARTNERS, MIG Fonds, BayBG, Target Partners, Kozo Keikaku Engineering",$44 Nnaisense,https://www.crunchbase.com/organization/nnaisense,"Artificial Intelligence, Industrial Automation, Machine Learning","Lugano, Ticino, Switzerland","Samsung Ventures, Alma Mundi Ventures, Repsol Energy Ventures, Schott",Noodle.ai,https://www.crunchbase.com/organization/noodle-analytics-inc-noodle-ai,"Artificial Intelligence, Big Data, Machine Learning, Supply Chain Management","San Francisco, California, United States","TPG Growth, Dell Technologies Capital",$51 NotCo,,Ingredient discovery,"Santiago de Chile, Santiago, Chile","SOSV, Kaszek Ventures, Bezos Expeditions, IndieBio, Maya Capital",$33 Obsidian Security,https://www.crunchbase.com/organization/obsidian-security,"Computer, Cyber Security, Network Security","Newport Beach, California, United States","Google Ventures, Greylock Partners, Wing Venture Capital",$30 Onfido,https://www.crunchbase.com/organization/onfido,"Artificial Intelligence, Identity Management, Information Technology, Security, Software","London, England, United Kingdom","Salesforce Ventures, M12, IDInvest Partners, SBI Group, CreditEase Fintech Investment Fund",$110 Osaro,https://www.crunchbase.com/organization/osaro,"Artificial Intelligence, Machine Learning, Robotics, Software","San Francisco, California, United States","Founders Fund, AME Cloud Ventures, Pegasus Tech Ventures, Peter Thiel, Alpha Intelligence Capital",$30 OWKIN,https://www.crunchbase.com/organization/owkin-2,"Artificial Intelligence, Biotechnology, Clinical Trials, Software","New York, New York, United States","Google Ventures, F-Prime Capital, Eight Roads Ventures, Cathay Innovation, Plug and Play Ventures",$35 PAIGE.AI,,Pathology,"New York, New York, United States","Breyer Capital, Memorial Sloan Kettering Cancer Center, HealthCare Ventures, Kenan Turnacioglu",$70 PerceptiLabs,https://www.crunchbase.com/organization/perceptilabs,"Artificial Intelligence, Web Development","Lidingo, Stockholms Lan, Sweden","Luminar Ventures, Brightly Ventures, STING Accelerator, Henrik von Schoultz, Hans Victor",$2 Primer,https://www.crunchbase.com/organization/primer-7cbe,"Artificial Intelligence, Content, Machine Learning","San Francisco, California, United States","Data Collective, Lux Capital, Crosslink Capital, AME Cloud Ventures, Bloomberg Beta",$55 ProteinQure,https://www.crunchbase.com/organization/proteinqure,Biotechnology,"Toronto, Ontario, Canada","8VC, Felicis Ventures, Global Founders Capital, Inovia Capital, Golden Ventures",$4 Razor Labs,https://www.crunchbase.com/organization/razor-labs,"Artificial Intelligence, Computer Vision, Industrial Automation, Machine Learning","Tel Aviv, Tel Aviv, Israel",BIRD Foundation,Recursion Pharmaceuticals,https://www.crunchbase.com/organization/recursion-pharmaceuticals,"Artificial Intelligence, Bioinformatics, Biotechnology, Pharmaceutical, Wellness","Salt Lake City, Utah, United States","Baillie Gifford & Co., Data Collective, Lux Capital, Menlo Ventures, Felicis Ventures",$265 Replica,https://www.crunchbase.com/organization/replica,"Computer, Software, Transportation","San Francisco, California, United States","Innovation Endeavors, Sidewalk Labs, Revolution Rise Of The Rest Seed Fund, Firebrand Ventures",$11 Second Spectrum,https://www.crunchbase.com/organization/second-spectrum,"Augmented Reality, Big Data, Computer Vision, Machine Learning, Sports","Los Angeles, California, United States",August Capital,$20 SentinelOne,https://www.crunchbase.com/organization/sentinel,"Computer, Cyber Security, Network Security, Security","Mountain View, California, United States","Tiger Global Management, Accel, Insight Partners, Redpoint Ventures, Data Collective",$430 Sherpa,https://www.crunchbase.com/organization/sherpa-assistant,"Artificial Intelligence, Internet of Things, Machine Learning, Mobile, Mobile Apps, Natural Language Processing, Predictive Analytics, Virtual Assistant","Bilbao, Pais Vasco, Spain","Horizon 2020, Alma Mundi Ventures, Alex Cruz",$17 Shield AI,https://www.crunchbase.com/organization/shield-ai,"Artificial Intelligence, Machine Learning, National Security, Robotics","San Diego, California, United States","Andreessen Horowitz, Homebrew, Breyer Capital",$45 Snyk,https://www.crunchbase.com/organization/snyk,"Developer Tools, Security, Software","London, England, United Kingdom","Accel, Google Ventures, Tiger Global Management, Coatue Management, Salesforce Ventures",$252 SparkCognition,https://www.crunchbase.com/organization/sparkcognition,"Analytics, Artificial Intelligence, Cyber Security, Machine Learning, Software","Austin, Texas, United States","Temasek, MSD Capital, Boeing HorizonX, March Capital Partners, Verizon Ventures",$168 Squirrel AI Learning,https://www.crunchbase.com/organization/yixue-squirrel-ai,"Artificial Intelligence, E-Learning, EdTech, Education, Internet","Shanghai, Shanghai, China","SIG Asia Investments, NGP Capital, CASH Capital Investment Management, New Oriental Education & Technology, QingSong Fund",$45 Standard Cognition,https://www.crunchbase.com/organization/standard-cognition,"Artificial Intelligence, Retail, Retail Technology, Shopping","San Francisco, California, United States","Y Combinator, CRV, Initialized Capital, EQT Ventures, Draper Associates",$86 Subtle Medical,https://www.crunchbase.com/organization/subtle-medical,"Artificial Intelligence, Computer Vision, Enterprise Software, Health Care, Health Diagnostics, Machine Learning, Medical, Medical Device, Pharmaceutical","Menlo Park, California, United States","Bessemer Venture Partners, Data Collective, Baidu Ventures, ZhenFund, Breyer Capital",$8 Synapse Technology,https://www.crunchbase.com/organization/synapse-technology-corporation,"Artificial Intelligence, Computer Vision, Information Technology, Machine Learning","Palo Alto, California, United States","Founders Fund, 8VC, Village Global, Xfund",$6 Synthesia Technologies,https://www.crunchbase.com/organization/synthesia,"Artificial Intelligence, Video","London, England, United Kingdom","Government of UK, Taavet Hinrikus, Seedcamp, MMC Ventures, Mark Cuban",$3 Syntiant,https://www.crunchbase.com/organization/syntiant,"Artificial Intelligence, Machine Learning, Semiconductor","Irvine, California, United States","Intel Capital, M12, Sunstone Capital, Robert Bosch Venture Capital, Amazon Alexa Fund",$30 Tachyus,https://www.crunchbase.com/organization/tachyus,"Analytics, Big Data, Data Visualization, Enterprise Software, Oil and Gas, Predictive Analytics, SaaS","San Mateo, California, United States","Founders Fund, Caffeinated Capital, Formation 8, Cota Capital, StartX",$41 The Yes,,E-commerce solutions,"San Francisco, California, United States","New Enterprise Associates, Bain Capital Ventures, Forerunner Ventures, True Ventures, Comcast Ventures",$30 Tractable,https://www.crunchbase.com/organization/tractable,"Artificial Intelligence, Insurance, Machine Learning, Software","London, England, United Kingdom","Insight Partners, Ignition Partners, Zetta Venture Partners, Entrepreneur First",$35 TuSimple,https://www.crunchbase.com/organization/tusimple-llc,"Artificial Intelligence, Autonomous Vehicles, Transportation","San Diego, California, United States","CDH Investments, Sina Weibo Fund, Composite Capital Partners, NVIDIA GPU Ventures, UPS Strategic Enterprise Fund",$297 Viz.ai,https://www.crunchbase.com/organization/viz,"Artificial Intelligence, Health Care, Health Diagnostics, Machine Learning, Medical","San Francisco, California, United States","Google Ventures, Kleiner Perkins Caufield & Byers, Greenoaks Capital Management, Threshold Ventures, CRV",$79 Voyage,https://www.crunchbase.com/organization/voyage,"Automotive, Autonomous Vehicles, Leisure, Public Transportation, Robotics","Palo Alto, California, United States","Khosla Ventures, CRV, Franklin Templeton, Initialized Capital, SV Angel",$54 WellSaid Labs,,Synthetic voice,"Seattle, Washington, United States",Allen Institute for Artificial Intelligence,Xanadu,https://www.crunchbase.com/organization/xanadu-2,"Artificial Intelligence, Big Data, Hardware, Quantum Computing, Software","Toronto, Ontario, Canada","Silicon Valley Bank, OMERS Ventures, Real Ventures, Georgian Partners, Sustainable Development Technology Canada",$34 Zebra Medical Vision,https://www.crunchbase.com/organization/zebra-medical-vision,"Artificial Intelligence, Health Care, Health Diagnostics, Machine Learning, Medical","Shefayim, HaMerkaz, Israel","Khosla Ventures, OurCrowd, Johnson & Johnson Innovation, Marc Benioff, Dolby Family Ventures",$50 Zesty.ai,https://www.crunchbase.com/organization/zesty-ai,"Analytics, Artificial Intelligence, InsurTech, Real Estate, Software","Oakland, California, United States","Plug and Play Ventures, Zurich Insurance Group, Plug and Play Accelerator, Blamar",$13 Zhuiyi Technology,https://www.crunchbase.com/organization/zhuiyi-technology,"Artificial Intelligence, Machine Learning, Software","Shenzhen, Guangdong, China","Morningside Venture Capital, GGV Capital, Gaorong Capital, China Merchants Capital, Sinovation Ventures",$62 